IssueKey,Summary,Description,IssueType,Priority,EpicLink,Status,AcceptanceCriteria
REQ-001,Email One-Time Code for Password Reset,Implement a feature allowing users to reset their password using a one-time code sent via email.,Story,High,Password Reset Feature,Draft,"User receives a one-time code via email upon requesting a password reset.
The one-time code expires after 10 minutes.
User can reset password using a valid one-time code."
REQ-002,OTP Verification Scenarios,Develop test cases for verifying the OTP functionality during password reset.,Story,High,Password Reset Feature,Draft,"Positive test case: User successfully resets password with a valid OTP.
Negative test case: User fails to reset password with an expired OTP.
Negative test case: User fails to reset password with an invalid OTP."
REQ-003,Rate Limiting for Password Reset Attempts,Implement rate limiting to restrict the number of password reset attempts per user.,Story,Medium,Password Reset Feature,Draft,"User can attempt password reset a maximum of 3 times per hour.
User receives an error message after exceeding the maximum attempts.
Rate limiting resets after one hour."
REQ-004,Audit Event for Successful Password Reset,Log an audit event whenever a password is successfully reset.,Story,Medium,Password Reset Feature,Draft,"An audit event is created upon successful password reset.
Audit event includes user ID and timestamp of the reset.
Audit logs are accessible for verification purposes."
